{
  "sourceManifestBuildId": "sourcemanifestbuild-002",
  "generatedAt": "2026-06-06T17:30:00Z",
  "domainSetupId": "domainsetup-001",
  "domain": "weather-logistics",
  "buildStatus": "rejected",
  "forecastGenerationAllowed": false,
  "canEnterSourceIntake": false,
  "confirmationRequired": false,
  "inputFiles": [
    {
      "fileId": "localfile-001",
      "localPath": "spec/fixtures/local-source-files/contains-secret.csv",
      "sourceRole": "historical_baseline",
      "fileFormat": "csv",
      "inspectionStatus": "rejected",
      "byteSize": 86,
      "rowCount": null,
      "contentHash": "6a0f1545e895981345fe7086d3e6a8884d232afee6b419471e409f4efdb53f74",
      "detectedFields": [
        "service_date",
        "geography",
        "api_key",
        "disrupted"
      ],
      "privacyFlags": {
        "containsSecrets": true,
        "containsPersonalData": false,
        "approvalRequired": false
      },
      "leakageFlags": {
        "hasPostOutcomeIndicators": false,
        "availableBeforeForecastClose": true
      },
      "reasonCodes": [
        "source_contains_secrets"
      ]
    }
  ],
  "draftArtifacts": {
    "sourceManifestId": null,
    "fieldMappingId": null,
    "sourceManifestPath": null,
    "fieldMappingPath": null
  },
  "requiredActions": [
    "Remove rejected files or provide caller-approved supported CSV/JSON sources."
  ],
  "warnings": [
    "Local builder drafts are not public read surfaces and do not authorize forecast execution."
  ]
}
